,question,context,answers,lang,source_lang,score,pred_answer
0,Missä nykyisessä valtiossa sijaitsee muinainen Pohjois-Traakia?,"Traakia (, ja , , , ) on historiallinen alue Kaakkois-Euroopassa Balkanilla. Siihen kuuluvat Kreikan koillisin osa eli Länsi-Traakia, Turkin Eurooppaan kuuluva alue eli Itä-Traakia sekä eteläinen Bulgaria. Nimellä Traakia on eri aikoina tarkoitettu eri laajuista aluetta. Vanhalla ajalla traakialaiset asuivat alueella, joka käsitti nykyisen Bulgarian ja Euroopan-puoleisen Turkin, Koillis-Kreikan sekä itäosan nykyistä Serbiaa ja Makedoniaa. Pohjoisessa se rajoittui Tonavaan, idässä Mustaanmereen ja Marmaramereen, etelässä Aigeianmereen ja lännessä Vardar- ja Iso Morava -jokiin. Roomalaisaikana Traakian provinssi oli hieman pienempi; sen pohjoisrajana olivat Balkanin vuoret ja länsirajana Mesta-joki. Kreikkaan kuuluva Traakian osa kuuluu hallinnolliseen alueeseen Itä-Makedonia ja Traakia. Turkkiin kuuluvasta Traakian","['Bulgaria', 'Kreikka ja Turkki']",fi,fi,45.968,Kaakkois-Euroopassa Balkanilla
1,Missä nykyisessä valtiossa sijaitsee muinainen Pohjois-Traakia?,"vallattua Makedonian myös Traakia joutui Rooman vallan alle. Traakiasta tuli Rooman provinssi ""Thracia"" vuonna 46. Bysantin valtakunta menetti Traakian Bulgarialle vuonna 917, mutta valtasi myöhemmin takaisin. Lopulta turkkilainen Osmanien valtakunta valtasi sen Bysantilta. Ensimmäisessä Balkanin sodassa vuosina 1912–1913 Bulgaria ja Kreikka valloittivat kumpikin osan siihen saakka Turkille kuuluneesta Traakiasta. Uudet rajat vahvistettiin sodan lopettaneessa rauhansopimuksessa, jossa Turkin Euroopan-puoleiset alueet pienenivät nykyiselleen. Rauhansopimuksen mukaan Bulgarialle kuului myös osa Egeanmeren pohjoisrannikkoa, jonka se kuitenkin menetti Kreikalle ensimmäisen maailmansodan jälkeen.","['Bulgaria', 'Kreikka ja Turkki']",fi,fi,42.468586,Makedonia
2,In what modern country is ancient northern Thracia?,"Thrace (; Modern , ""Thráki""; , ""Trakiya""; ) is a geographical and historical area in Southeast Europe, now split between Bulgaria, Greece and Turkey, which is bounded by the Balkan Mountains to the north, the Aegean Sea to the south and the Black Sea to the east. It comprises southeastern Bulgaria (Northern Thrace), northeastern Greece (Western Thrace) and the European part of Turkey (East Thrace). In antiquity, it was also referred to as ""Europe"", prior to the extension of the term to describe the whole continent. The name ""Thrace"" comes from the Thracians, an ancient Indo-European people inhabiting Southeast Europe.","['Bulgaria', 'Greece and Turkey']",en,fi,42.34554,southeastern Bulgaria
3,¿En qué país moderno está el antiguo norte de Tracia?,"Tracia (en búlgaro Тракия, ""Trakija""; en griego Θράκη, ""Thráki""; en turco Trakya) es una región del sureste de Europa, en la península de los Balcanes, al norte del mar Egeo, enclavada en Bulgaria, Grecia y la Turquía europea. En su época, esta región histórica se extendía desde Macedonia hasta el mar Negro y desde el mar Egeo hasta el río Danubio. Ocupa la punta del sureste de la península balcánica y comprende el nordeste de Grecia, el sur de Bulgaria y la zona europea de Turquía. Sus límites han variado en diferentes períodos. Las montañas Ródope separan la Tracia griega","['Bulgaria', 'Grecia y Turquía']",es,fi,42.08412,"Bulgaria, Grecia y la Turquía europea"
4,Di negeri modern apa Thracia bagian utara?,"Thrake [ thra-ké ], Thrace [tréis] atau Trakia [tra-ki-a] (, ""Thráke""; , ""Trakiya""; ) adalah sebuah kawasan geografi dan bersejarah di tenggara Eropah, kini terpecah ke dalam wilayah negara Bulgaria, Yunani dan Turki, yang mana bersempadanan dengan Pergunungan Balkan di utara, Laut Aegea di selatan dan Laut Hitam di timur. Ia terdiri daripada tenggara Bulgaria (Thrake Utara), timur laut Yunani (Thrake Barat) dan bahagian Eropah di Turki (Thrake Timur). Pada Zaman Klasik, ia juga dirujuk sebagai ""Eropah"", sebelum istilah ini diperluaskan untuk memperincikan keseluruhan benua. Nama ""Thrake"" berasal dari orang Thrakia, satu kaum purba Indo-Eropah yang mendiami Eropah Tenggara. Trakiya","['Bulgaria', 'Yunani dan Turki']",id,fi,40.405296,Bulgaria
