,question,context,answers,lang,source_lang,score,pred_answer
0,Mikä on Madagaskarin pääkaupunki?,"Antananarivo on Madagaskarin pääkaupunki ja samalla myös saaren suurin kaupunki. Se sijaitsee Antananarivon provinssissa. Antananarivo perustettiin noin vuonna 1625. Monista muista Afrikan kaupungeista poiketen se oli merkittävä keskus jo ennen siirtomaa-aikaa. Vuonna 1793 siitä tuli Imerinan kuningaskunnan pääkaupunki, jolloin sinne rakennettiin linnoitus. Myöhemmin se oli lähes koko saaren hallinnollinen keskus. Vuonna 1895 ranskalaiset valloittivat kaupungin. Kaupungista tehtiin Ranskan Madagaskarin pääkaupunki ja kuvernööriä varten rakennettiin palatsi. Palatsin nimi on nykyään Ambohitsorohitran palatsi ja sitä käyttää maan presidentti. Ranskan valtakaudella kaupunkia uudistettiin. Vuonna 1897 aloitettiin rautatien rakentaminen. Kaupungin monien kukkuloiden läpi kaivettiin tunneleita helpottamaan sisäistä liikennettä ja kaupunkia sähköistettiin. Kaupungin katuja päällystettiin","['Antananarivo', 'Antananarivo']",fi,fi,47.585175,Antananarivo
1,Mikä on Madagaskarin pääkaupunki?,"ja sinne rakennettiin ranskalaistyylisiä bulevardeja. Väkiluvuksi saatiin vuoden 1950 väestönlaskussa 175 000 asukasta. Vuonna 1955 avattiin yliopisto. Vuoteen 1960 sijoittuvan itsenäistymisen myötä Antananarivosta tuli Madagaskarin tasavallan pääkaupunki. Vuonna 1972 kaupungissa tapahtuneet Rotaka-mellakat johtivat presidentti Philibert Tsirananan eroon. Vuonna 2005 Antananarivon asukasluvuksi arvioitiin noin 1 613 375. Madagaskarin poliittinen kriisi vuonna 2009 aiheutti kaupungissa mielenosoituksia. Antananarivo sijaitsee saaren keskiylängöllä, noin 1470 metriä merenpinnan yläpuolella, ja on rakennettu kukkuloille. Kaupungin hallitsematon kasvu on aiheuttanut ongelmia veden- ja sähkönjakelussa. Sen liikenne on nykyään ruuhkautunutta. Kaupunki on Madagaskarin teollisuuden, kaupan ja liikenteen keskus, jossa on muun muassa tupakka-, paperi- ja elintarviketeollisuutta. Antananarivon ja Tamataven","['Antananarivo', 'Antananarivo']",fi,fi,47.056187,Antananarivo
2,Apa ibu kota Madagaskar?,Antananarivo ( atau ) ialah ibu negara dan bandar terbesar Madagaskar. La juga dikenali dengan nama Tananarive atau singkatannya Tana dalam Bahasa Perancis. Terdapat 50 buah gereja di kawasan bandar dan pinggir bandar Antananarivo. Di Antananarivo juga terdapat Universiti Madagaskar (University of Madagascar) dan Collège Rural d'Ambatobe.,"['Antananarivo', 'Antananarivo']",id,fi,45.60717,Antananarivo
3,Vad är Madagaskars huvudstad?,"Antananarivo, tidigare Tananarive och Tananarivo, ofta kallad ""Tana"" eller ""Iarivo"", är Madagaskars huvudstad, med omkring 1,4 miljoner invånare (år 2005), belägen på högplatån mitt på ön (centrum omkring 1 250 meter över havet). Stadskommunen heter Antananarivo-Renivohitra (""huvudstaden"") med 903 450 invånare och en area på 107 km². Den skrivs ibland som CUA (Commune Urbaine d'Antananarivo). Huvudstaden omges av distrikten Antananarivo-Atsimondrano (""söder om vattnet""), med 292 057 invånare och en area på 379 km², och Antananarivo-Avaradrano (""norr om vattnet"") med 207 942 invånare och en area på 545 km² . FIFTAMA (""Stor-Antananarivo"") är en samarbetsorganisation för 28 kommuner som omger huvudstaden.","['Antananariv', 'Antananariv']",sv,fi,44.788116,Antananarivo
4,Madagaskar’ın başkenti nedir?,"Amparafaravola, Afrika kıtasına bağlı ada konumunda olan Madagaskar devletinde bir şehirdir. Şehir ülkenin orta bölümünün kuzeydoğu kesiminde Alaotra-Mangoro bölgesi içerisinde yer almaktadır. Şehirde 2013 tahmini verilerine göre 54.100 nüfus yaşamaktadır. Amparafaravola ülkenin başkenti Antananarivo'nun kuzeydoğusunda yer almaktadır.","['Antananarya', 'Antananarya']",tr,fi,43.72307,Antananarivo
5,Mikä on Madagaskarin pääkaupunki?,"Antananarivo oli provinssi Madagaskarissa. Se sijaitsi sisämaassa. Provinssin pinta-ala oli 58 283 neliökilometriä ja arvioitu asukasluku noin 4 580 788 (2001). Antananarivon provinssi oli nimetty pääkaupunkinsa Antananarivon mukaan, joka on samalla myös koko Madagaskarin pääkaupunki. Vuonna 2007 Madagascar päätti hallinnonuudistuksesta, jossa se luopui provinssijaosta ja korvasi ne 22 alueella. Uudistus tuli voimaan 2009.","['Antananarivo', 'Antananarivo']",fi,fi,43.376427,Antananarivo
6,Mikä on Madagaskarin pääkaupunki?,"ja kahviviljelmiä. Antananarivo, Fianarantsoa, Toamasina ja Mahajanga muodostuivat käsityöammattien ja kaupan keskuksiksi. Ranskan uhkaa heikentääkseen Rainilaiarivony solmi vuonna 1865 kauppasopimuksen Britannian ja vuonna 1867 Yhdysvaltojen kanssa. Anglikaanisuus julistettiin valtionuskonnoksi vuonna 1869. Ranska solmi Madagaskarin kanssa rauhan- ja kauppasopimuksen vuonna 1868. Ranskan siirtomaavallan laajentuminen keskeytti Madagaskarin itsenäisen kehityksen. Ranska aloitti vuonna 1883 sodan, mutta kärsi syyskuussa 1885 tappion Toamasinan luona. Vihollisen sotilaallinen ylivoima pakotti kuitenkin Madagaskarin luovuttamaan Ranskalle maan ulkomaansuhteiden hoidon, maksamaan sotakorvauksia ja antamaan sille Diego Suarezin tukikohdan (nykyinen Antsiranana). Vuonna 1890 solmitussa sopimuksessa Ranska tunnusti Sansibariin kohdistuvat Britannian vaatimukset, ja Britannia luopui samalla oikeuksistaan Madagaskariin. Ranska aloitti joulukuussa 1894","['Antananarivo', 'Antananarivo']",fi,fi,43.312428,Antsiranana
7,Madagaskar’ın başkenti nedir?,"Antananarivo (Malgaşça'da ""Binlerin Şehri"" anlamına gelir; Fransızca: ""Tananarive""), Madagaskar'ın başkenti ve en büyük şehridir. Kısaca ""Tana"" olarak da bilinir. Madagaskar 1625'te Kral Andrianjaka tarafından kurulmuştur. Şehri koruma altına alın birçok askerin olması nedeniyle şehre ""Antananarivo"" (""Binlerin Şehri"") ismi verilmiştir. Fransız İmparatorluğu'nun sömürge şehirlerinden biri olmadan önce bile büyük bir şehir hâline gelmiştir. Günümüzdeki bağımsız Madagaskar ile şehir merkezin nüfusu 903.450, toplam nüfusu ise 1.403.449.","['Antananarya', 'Antananarya']",tr,fi,42.97024,Antananarivo
